{
  "descriptor_version": "cordis-plugin-descriptor.v1",
  "id": "opl-package-host",
  "plugin_id": "opl-package-host",
  "plugin_ref": "cordis:plugin:opl-package-host@1.0.0",
  "plugin_api_version": "1.0.0",
  "source_ref": "packages/package-host/src/plugin.ts",
  "source_commit": "97510b268300b1996f308e7a4110205cd703b95e",
  "source_identity": "git:97510b268300b1996f308e7a4110205cd703b95e:packages/package-host/src/plugin.ts",
  "package_ref": {
    "package_id": "@one-person-lab/package-host",
    "package_version": "0.1.0",
    "package_ref": "npm:@one-person-lab/package-host@0.1.0"
  },
  "required": true,
  "provides": [
    "opl.pack.package-host"
  ],
  "injects": {
    "required": [],
    "optional": []
  },
  "events": [],
  "scope": "composition",
  "trust": "first_party_privileged",
  "disposer": {
    "required": true,
    "boundary": "plugin_fiber"
  },
  "authority_boundary": {
    "forbidden_authorities": [
      "package_installed_truth",
      "package_currentness",
      "native_carrier_lifecycle",
      "temporal_workflow_history",
      "temporal_retry_replay",
      "workspace_file_bytes",
      "workspace_binding_registry",
      "workspace_restore_delete_authority",
      "ledger_evidence_persistence",
      "ledger_receipt_authority",
      "foundry_agent_version",
      "foundry_promotion_activation",
      "domain_truth",
      "domain_quality_verdict",
      "app_product_truth",
      "credential_material",
      "security_sandbox"
    ]
  }
}
