{
  "descriptor_version": "cordis-plugin-descriptor.v1",
  "id": "opl-atlas-catalog",
  "plugin_id": "opl-atlas-catalog",
  "plugin_ref": "cordis:plugin:opl-atlas-catalog@1.0.0",
  "plugin_api_version": "1.0.0",
  "source_ref": "src/modules/atlas/cordis-domain-manifest-catalog.ts",
  "source_commit": "898c21f3bbb4e55b771cc411aa51898476023973",
  "source_identity": "git:898c21f3bbb4e55b771cc411aa51898476023973:src/modules/atlas/cordis-domain-manifest-catalog.ts",
  "package_ref": null,
  "required": true,
  "provides": [
    "opl.atlas.catalog"
  ],
  "injects": {
    "required": [],
    "optional": []
  },
  "events": [
    {
      "name": "opl/atlas/catalog/observed",
      "mode": "emit",
      "role": "publish",
      "payload_schema_ref": null
    }
  ],
  "scope": "composition",
  "trust": "first_party_privileged",
  "disposer": {
    "required": true,
    "boundary": "plugin_fiber"
  },
  "authority_boundary": {
    "forbidden_authorities": [
      "app_product_truth",
      "domain_quality_verdict",
      "domain_truth",
      "ledger_evidence_persistence",
      "ledger_receipt_authority",
      "package_currentness",
      "package_installed_truth",
      "workspace_binding_registry",
      "workspace_file_bytes"
    ]
  }
}
